MatchNumber,Date,HomeTeam,AwayTeam,HomeLineup,AwayLineup
287,2023-04-16,Girona,Elche,"paulo gazzaniga, javier hernandez, juanpe, santiago bueno, arnau martinez, oriol romeu, toni villa, borja garcia, ivan martin, viktor tsygankov, taty castellanos","axel werner, helibelton palacios, omar mascarell, pedro bigas, carlos clerc, gerard gumbau, john donald, pere milla, raul guti, tete morente, lucas boye"
288,2023-04-16,Getafe,Barcelona,"david soria, juan iglesias, omar alderete, domingos duarte, djene, damian suarez, munir el haddadi, luis milla, nemanja maksimovic, enes unal, borja mayoral","marc-andre ter stegen, sergi roberto, ronald araujo, jules kounde, jordi alba, franck kessie, sergio busquets, gavi, raphinha, robert lewandowski, alejandro balde"
289,2023-04-16,Atlético,Almería,"jan oblak, yannick carrasco, mario hermoso, jose maria gimenez, axel witsel, nahuel molina, rodrigo de paul, koke, marcos llorente, antoine griezmann, angel correa","fernando martinez, kaiky, rodrigo ely, stefan babic, houboulang mendes, lucas robertone, samu costa, alex centelles, gonzalo melero, leo baptistao, luis suarez"
290,2023-04-16,Valencia,Sevilla,"giorgi mamardashvili, toni lato, cenk ozkaçar, mouctar diakhaby, dimitri foulquier, jose luis gaya, andre almeida, ilaix moriba, yunus musah, edinson cavani, samu castillejo","marko dmitrovic, jesus navas, loic bade, nemanja gudelj, karim rekik, fernando, joan jordan, lucas ocampos, suso, bryan gil, youssef en-nesyri"
291,2023-04-17,Celta,Mallorca,"ivan villar, javi galan, unai nuñez, joseph aidoo, hugo mallo, luca de la torre, fran beltran, gabri veiga, miguel rodriguez, haris seferovic, iago aspas","predrag rajkovic, antonio sanchez, martin valjent, antonio raillo, dennis, hadzikadunic, pablo maffeo, manu morlanes, iñigo ruiz de galarreta, kang-in lee, vedat muriqi, amath ndiaye"
292,2023-04-21,Espanyol,Cádiz,"fernando pacheco, adria pedrosa, leandro cabrera, sergi gomez, cesar montes, oscar gil, sergi darder, jose gragera, nicolas melamed, joselu, martin braithwaite","conan ledesma, iza carcelen, luis hernandez, fali, alfonso espino, theo bongonda, ruben alcaraz, fede san emeterio, ruben sobrino, sergi guardiola, chris ramos"
293,2023-04-22,Osasuna,Real Betis,"sergio herrera, juan cruz, david garcia, aridane hernandez, ruben peña, pablo ibañez, jon moncayola, aimar oroz, abde ezzalzouli, ante budimir, kike barja","rui silva, martin montoya, luiz felipe, edgar gonzalez, juan miranda, guido rodriguez, andres guardado, luiz henrique, william carvalho, ayoze perez, borja iglesias"
294,2023-04-22,Almería,Athletic,"fernando martinez, alex centelles, stefan babic, rodrigo ely, chumi, samu costa, lucas robertone, leo baptistao, gonzalo melero, arnau puigmal, luis suarez","unai simon, oscar de marcos, yeray alvarez, iñigo martinez, yuri berchiche, ander herrera, mikel vesga, iñaki williams, oihan sancet, nico williams, gorka guruzeta"
295,2023-04-22,R. Sociedad,Rayo Vallecano,"alex remiro, aihen muñoz, jon pacheco, igor zubeldia, aritz elustondo, martin zubimendi, ander barrenetxea, mikel merino, david silva, alexander sorloth, mikel oyarzabal","stole dimitrievski, ivan balliu, florian lejeune, abdul mumin, fran garcia, santi comesaña, oscar valentin, isi palazon, oscar trejo, andres martin, raul de tomas"
296,2023-04-22,Real Valladolid,Girona,"jordi masip, sergio escudero, jawad el yamiq, joaquin fernandez, ivan fresneda, monchu, martin hongla, kike perez, selim amallah, cyle larin, gonzalo plata","paulo gazzaniga, arnau martinez, bernardo espinosa, juanpe, javier hernandez, oriol romeu, viktor tsygankov, ivan martin, aleix garcia, toni villa, christian stuani"
297,2023-04-22,Real Madrid,Celta,"thibaut courtois, eduardo camavinga, antonio rudiger, eder militao, nacho fernandez, dani ceballos, aurelien tchouameni, federico valverde, vinicius junior, karim benzema, marco asensio","ivan villar, kevin vazquez, renato tapia, unai nuñez, javi galan, augusto solari, gabri veiga, fran beltran, luca de la torre, iago aspas, haris seferovic"
298,2023-04-23,Elche,Valencia,"edgar badia, carlos clerc, pedro bigas, gonzalo verdu, omar mascarell, tete morente, fidel, john donald, raul guti, lucas boye, pere milla","giorgi mamardashvili, dimitri foulquier, gabriel paulista, mouctar diakhaby, cenk ozkaçar, jose luis gaya, yunus musah, nico gonzalez, andre almeida, edinson cavani, samuel lino"
299,2023-04-23,Barcelona,Atlético,"marc-andre ter stegen, alejandro balde, marcos alonso, ronald araujo, jules kounde, frenkie de jong, sergio busquets, ferran tores, gavi, raphinha, robert lewandowski","jan oblak, nahuel molina, stefan savic, jose maria gimenez, mario hermoso, yannick carrasco, rodrigo de paul, axel witsel, thomas lemar, angel correa, antoine griezmann"
300,2023-04-23,Mallorca,Getafe,"perdrag rajkovic, pablo maffeo, dennis hadzikadunic, antonio raillo, martin valjent, antonio sanchez, kang-in lee, iñigo ruiz de galarreta, manu morlanes, amath ndiaye, vedat muriqi","david soria, damian suarez, djene, domingos duarte, omar alderete, juan iglesias, nemanja maksimovic, luis milla, munir el haddadi, borja mayoral, enes unal"
301,2023-04-23,Sevilla,Villarreal,"marko dmitrovic, alex telles, loic bade, tanguy nianzou, gonzalo montiel, ivan rakitic, pape gueye, bryan gil, oliver torres, suso, rafa mir","pepe reina, juan foyth, aissa mandi, pau torres, alfonso pedraza, samu chukwueze, dani parejo, ramon terrats, yeremy pino, giovani lo celso, jose luis morales"
302,2023-04-25,Cádiz,Osasuna,"conan ledesma, alfonso espino, victor chust, luis hernandez, iza carcelen, ruben sobrino, ruben alcaraz, fede san emeterio, theo bongonda, chris ramos, roger marti","aitor fernandez, nacho vidal, unai garcia, juan cruz, manu sanchez, iker muñoz, ruben garcia, moi gomez, pablo ibañez, iker benito, ante budimir"
303,2023-04-25,Girona,Real Madrid,"paulo gazzaniga, miguel gutierrez, juanpe, santiago bueno, arnau martinez, oriol romeu, rodrigo riquelme, ivan martin, viktor tsygankov, yan couto, taty castellanos","andriy lunin, daniel carvajal, eder militao, antonio rudiger, nacho fernandez, federico valverde, toni kroos, luka modric, marco asensio, rodrygo, vinicius junior"
304,2023-04-25,Real Betis,R. Sociedad,"rui silva, juan miranda, german pezzella, luiz felipe, aitor ruibal, andres guardado, guido rodriguez, rodri sanchez, william carvalho, sergio canales, ayoze perez","alex remiro, andoni gorosabel, igor zubeldia, robin le normand, aihen muñoz, martin zubimendi, takefusa kubo, illarramendi, brais mendez, mikel oyarzabal, alexander sorloth"
305,2023-04-26,Atlético,Mallorca,"ivo grbic, yannick carrasco, mario hermoso, jose maria gimenez, axel witsel, nahuel molina, thomas lemar, koke, rodrigo de paul, antoine griezmann, alvaro morata","predrag rajkovic, pablo maffeo, dennis hadzikadunic, matija nastasic, jose copete, jaume costa, manu morlanes, iddrisu baba, dani rodriguez, angel rodriguez, abdon prats"
306,2023-04-26,Getafe,Almería,"david soria, omar alderete, domingos duarte, djene, portu, luis milla, nemanja maksimovic, damian suarez, munir el haddadi, enes unal, borja mayoral","fernando martinez, alejandro pozo, chumi, stefan babic, alex centelles, gonzalo melero, cesar de la hoz, lucas robertone, leo baptistao, luis suarez, adrian embarba"
307,2023-04-26,Celta,Elche,"ivan villar, javi galan, renato tapia, joseph aidoo, hugo mallo, luca de la torre, fran beltran, gabri veiga, carles perez, gonçalo paciencia, iago aspas","edgar badia, josan, omar mascarell, lisando magallan, carlos clerc, gerard gumbau, john donald, fidel, tete morente, randy nteka, pere milla"
308,2023-04-26,Rayo Vallecano,Barcelona,"stole dimitrievski, fran garcia, alejandro catena, florian lejeune, ivan balliu, alvaro garcia, oscar valentin, unai lopez, isi palazon, oscar trejo, sergio camello","marc-andre ter stegen, jules kounde, ronald araujo, marcos alonso, alejandro balde, pedri, frenkie de jong, gavi, raphinha, robert lewandowski, ferran torres"
309,2023-04-27,Valencia,Real Valladolid,"giorgi mamardashvili, jose luis gaya, cenk ozkaçar, mouctar diakhaby, gabriel paulista, dimitri foulquier, samuel lino, andre almeida, nico gonzalez, yunus musah, edinson cavani","jordi masip, ivan fresneda, joaquin fernandez, martin hongla, jawad el yamiq, sergio escudero, selim amallah, monchu, kike perez, gonzalo plata, cyle larin"
310,2023-04-27,Villarreal,Espanyol,"pepe reina, alberto moreno, pau torres, aissa mandi, juan foyth, etienne capoue, dani parejo, yeremy pino, giovani lo celso, samu chukwueze, nicolas jackson","fernando pacheco, fernando calero, cesar montes, sergi gomez, oscar gil, javi puado, keidi bare, vini souza, martin braithwaite, sergi darder, joselu"
311,2023-04-27,Athletic,Sevilla,"unai simon, yuri berchiche, yeray alvarez, dani vivian, oscar de marcos, dani garcia, ander herrera, nico williams, oihan sancet, iñaki williams, gorka guruzeta","marko dmitrovic, jesus navas, loic bade, nemanja gudelj, marcos acuña, fernando, ivan rakitic, lucas ocampos, suso, erik lamela, youssef en-nesyri"
312,2023-04-28,Osasuna,R. Sociedad,"sergio herrera, manu sanchez, juan cruz, aridane hernandez, ruben peña, iker muñoz, jon moncayola, moi gomez, aimar oroz, kike barja, kike garcia","alex remiro, aritz elustondo, igor zubeldia, robin le normand, aihen muñoz, mikel merino, martin zubimendi, david silva, mohamed-ali cho,carlos fernandez, ander barrenetxea"
313,2023-04-29,Elche,Rayo Vallecano,"edgar badia, lautaro blanco, carlos clerc, lisandro magallan, josan, gerard gumbau, john donald, pere milla, fidel, tete morente, lucas boye","stole dimitrievski, ivan balliu, florian lejeune, alejandro catena, fran garcia, pathe ciss, santi comesaña, salvi sanchez, isi palazon, alvaro garcia, sergio camello"
314,2023-04-29,Real Madrid,Almería,"thibaut courtois, eduardo camavinga, antonio rudiger, eder militao, lucas vazquez, toni kroos, aurelien tchouameni, dani ceballos, vinicius junior, karim benzema, rodrygo","fernando martinez, houboulang mendes, chumi, rodrigo ely, sergio akieme, arnau puigmal, francisco portillo, cesar de la hoz, samu costa, largie ramazani, lazaro"
315,2023-04-29,Barcelona,Real Betis,"marc-andre ter stegen, alejandro balde, andreas christensen, ronald araujo, jules kounde, frenkie de jong, sergio busquets, pedri, gavi, robert lewandowski, raphinha","rui silva, martin montoya, german pezzella, luiz felipe, juan miranda, guido rodriguez, william carvalho, luiz henrique, sergio canales, ayoze perez, willian jose"
316,2023-04-30,Cádiz,Valencia,"conan ledesma, alfonso espino, fali, luis hernandez, raul parra, ruben sobrino, fede san emeterio, gonzalo escalante, ivan alejo, chris ramos, sergi guardiola","giorgi mamardashvili, dimitri foulquier, eray comert, mouctar diakhaby, cenk ozkaçar, toni lato, yunus musah, ilaix moriba, nico gonzalez, samuel lino, hugo duro"
317,2023-04-30,Villarreal,Celta,"pepe reina, alberto moreno, pau torres, aissa mandi, juan foyth, etienne capoue, dani parejo, yeremy pino, giovani lo celso, samu chukwueze, nicolas jackson","ivan villar, kevin vazquez, joseph aidoo, unai nuñez, javi galan, luca de la torre, oscar rodriguez, renato tapia, franco cervi, jorgen strand larsen, haris seferovic"
318,2023-04-30,Espanyol,Getafe,"fernando pacheco, adria pedrosa, leandro cabrera, sergi gomez, fernando calero, oscar gil, sergi darder, denis suarez, nicolas melamed, joselu, martin braithwaite","david soria, damian suarez, domingos duarte, omar alderete, gaston alvarez, portu, nemanja maksimovic, gonzalo villar, carlos aleña, enes unal, borja mayoral"
319,2023-04-30,Real Valladolid,Atlético,"jordi masip, jawad el yamiq, martin hongla, joaquin fernandez, ivan fresneda, kike perez, monchu, luis perez, alvaro aguado, cyle larin, gonzalo plata","ivo grbic, nahuel molina, axel witsel, jose maria gimenez, mario hermoso, yannick carrasco, rodrigo de paul, koke, thomas lemar, alvaro morata, antoine griezmann"
320,2023-05-01,Mallorca,Athletic,"predrag rajkovic, jaume costa, jose copete, antonio raillo, martin valjent, pablo maffeo, kang-in lee, iñigo ruiz de galarreta, manu morlanes, vedat muriqi, amath ndiaye","julen agirrezabala, aitor paredes, dani vivian, yeray alvarez, yuri berchiche, ander herrera, mikel vesga, iñaki williams, raul garcia, alex berenguer, gorka guruzeta"
321,2023-05-01,Sevilla,Girona,"mark dmitrovic, marcos acuña, nemanja gudelj, loic bade, gonzalo montiel, pape gueye, fernando, bryan gil, papu gomez, lucas ocampos, youssef en-nesyri","paulo gazzaniga, yan couto, santiago bueno, juanpe, javier hernandez, miguel gutierrez, viktor tsygankov, ivan martin, oriol romeu, rodrigo riquelme, taty castellanos"
322,2023-05-02,Almería,Elche,"fernando martinez, alex centelles, stefan babic, rodrigo ely, alejandro pozo, gonzalo melero, cesar de la hoz, lucas robertone, adrian embarba, luis suarez, leo baptistao","axel werner, josan, lisandro magallan, carlos clerc, lautaro blanco, tete morente, fidel, john donald, gerard gumbau, lucas boye, pere milla"
323,2023-05-02,Barcelona,Osasuna,"marc-andre ter stegen, alejandro balde, andreas christensen, ronald araujo, jules kounde, frenkie de jong, sergio busquets, gavi, pedri, raphinha, robert lewandowski","aitor fernandez, diego moreno, unai garcia, jorge herrando, manu sanchez, pablo ibañez, lucas torro, ruben garcia, aimar oroz, iker benito, chimy avila"
324,2023-05-02,R. Sociedad,Real Madrid,"alex remiro, aihen muñoz, robin le normand, igor zubeldia, andoni gorosabel, martin zubimendi, mikel oyarzabal, david silva, mikel merino, takefusa kubo, alexander sorloth","thibaut courtois, daniel carvajal, eder militao, antonio rudiger, nacho fernandez, daniel ceballos, aurelien tchouameni, toni kroos, marco asensio, mariano diaz, rodrygo"
325,2023-05-03,Valencia,Villarreal,"giorgi mamardashvili, jose luis gaya, gabriel paulista, mouctar diakhaby, thierry correia, nico gonzalez, javi guerra, samuel lino, andre almeida, yunus musah, edinson cavani","pepe reina, juan foyth, raul albiol, pau torres, alfonso pedraza, ramon terrats, dani parejo, alex baena, samu chukwueze, nicolas jackson, yeremy pino"
326,2023-05-03,Atlético,Cádiz,"ivo grbic, yannick carrasco, mario hermoso, jose maria gimenez, axel witsel, nahuel molina, thomas lemar, koke, rodrigo de paul, alvaro morata, antoine griezmann","conan ledesma, iza carcelen, jorge mere, momo mbaye, santiago arzamendia, youba diarra, theo bongonda, ruben alcaraz, alex fernandez, ivan alejo, alvaro negredo"
327,2023-05-03,Getafe,Celta,"david soria, gaston alvarez, stefan mitrovic, djene, damian suarez, nemanja maksimovic, mauro arambarri, juan iglesias, jaime mata, enes unal, carles aleña","ivan villar, hugo mallo, joseph aidoo, unai nuñez, javi galan, kevin vazquez, gabri veiga, fran beltran, franco cervi, iago aspas, jorgen strand larsen"
328,2023-05-04,Girona,Mallorca,"paulo gazzaniga, miguel gutierrez, bernardo espinosa, santiago bueno, arnau martinez, oriol romeu, rodrigo riquelme, reinier, ivan martin, viktos tsygankov, taty castellanos","predrag rajkovic, antonio sanchez, dennis hadzikadunic, martin valjent, jose copete, jaume costa, amath ndiaye, manu morlanes, iñigo ruiz de galarreta, kang-in lee, vedat muriqi"
329,2023-05-04,Sevilla,Espanyol,"marko dmitrovic, alex telles, karim rekik, nemanja gudelj, jesus navas, pape gueye, ivan rakitic, bryan gil, oliver torres, suso, rafa mir","fernando pacheco, oscar gil, cesar montes, sergi gomez, leando cabrera, brian olivan, nicolas melamed, sergi darder, denis suarez, javi puado, joselu"
330,2023-05-04,Athletic,Real Betis,"unai simon, yuri berchiche, aitor paredes, dani vivian, oscar de marcos, mikel vesga, dani garcia, nico williams, oihan sancet, iñaki williams, gorka guruzeta","claudo bravo, youssouf sabaly, german pezzella, paul akouokou, juan miranda, guido rodriguez, andres guardado, sergio canales, william carvalho, ayoze perez, willian jose"
331,2023-05-04,Rayo Vallecano,Real Valladolid,"stole dimitrievski, fran garcia, alejandro catena, abdul mumin, ivan balliu, santi comesaña, oscar valentin, alvaro garcia, oscar trejo, isi palazon, raul de tomas","jordi masip, jawad el yamiq, martin hongla, javi sanchez, luis perez, monchu, kike perez, sergio escudero, alvaro aguado, gonzalo plata, cyle larin"
332,2023-05-12,Mallorca,Cádiz,"predrag rajkovic, jose copete, iddrisu baba, martin valjent, jaume costa, iñigo ruiz de galarreta, manu morlanes, pablo maffeo, kang-in lee, vedat muriqi, amath ndiaye","conan ledesma, iza carcelen, luiz hernandez, fali, alfonso espino, ivan alejo, gonzalo escalante, fede san emeterio, ruben sobrino, sergi guardiola, chris ramos"
333,2023-05-13,R. Sociedad,Girona,"alex remiro, aihen muñoz, robin le normand, igor zubeldia, andoni gorosabel, mikel oyarzabal, mikel merino, martin zubimendi, takefusa kubo, alexander sorloth, david silva","paulo gazzaniga, arnau martinez, santiago bueno, david lopez, javier hernandez, oriol romeu, yan couto, viktor tsygankov, ivan martin, rodrigo riquelme, christian stuani"
334,2023-05-13,Osasuna,Almería,"aitor fernandez, manu sanchez, david garcia, aridane hernandez, ruben peña, aimar oroz, lucas torro, jon moncayola, abde ezzalzouli, ante budimir, kike barja","fernando martinez, alejandro pozo, rodrigo ely, stefan babic, alex centelles, gonzalo melero, cesar de la hoz, lucas robertone, leo baptistao, luis suarez, adrian embarba"
335,2023-05-13,Villarreal,Athletic,"pepe reina, alfonso pedraza, pau torres, aissa mandi, juan foyth, alex baena, dani parejo, etienne capoue, yeremy pino, nicolas jackson, samu chukwueze","unai simon, iñigo lekue, yeray alvarez, aitor paredes, yuri berchiche, dani garcia, ander herrera, nico williams, oihan sancet, alex berenguer, iñaki williams"
336,2023-05-13,Real Madrid,Getafe,"thibaut courtois, ferland mendy, nacho fernandez, eder militao, lucas vazquez, eduardo camavinga, aurelien tchouameni, dani ceballos, eden hazard, marco asensio, federico valverde","david soria, juan iglesias, stefan mitrovic, omar alderete, gaston alvarez, carles aleña, djene, nemanja maksimovic, portu, borja mayoral, jaime mata"
337,2023-05-14,Celta,Valencia,"ivan villar, franco cervi, unai nuñez, renato tapia, hugo mallo, luca de la torre, gabri veiga, fran beltran, carles perez, haris seferovic, iago aspas","giorgi mamardashvili, dimitri foulquier, mouctar diakhaby, gabriel paulista, jose luis gaya, nico gonzalez, javi guerra, diego lopez, andre almeida, samuel lino, justin kluivert"
338,2023-05-14,Elche,Atlético,"edgar badia, carlos clerc, pedro bigas, helibelton palacios, lautaro blanco, gerard gumbau, john donald, tete morente, fidel, lucas boye, randy nteka","ivo grbic, axel witsel, jose maria gimenez, mario hermoso, nahuel molina, rodrigo de paul, koke, thomas lemar, yannick carrasco, antoine griezmann, alvaro morata"
339,2023-05-14,Real Valladolid,Sevilla,"jordi masip, sergio escudero, david torres, javi sanchez, lucas rosa, kike perez, martin hongla, monchu, kenedy, cyle larin, gonzalo plata","marko dmitrovic, gonzalo montiel, loic bade, karim rekik, alex telles, ivan rakitic, pape gueye, erik lamela, oliver torres, papu gomez, rafa mir"
340,2023-05-14,Espanyol,Barcelona,"fernando pacheco, brian olivan, leandro cabrera, sergi gomez, cesar montes, oscar gil, denis suarez, sergi darder, nicolas melamed, joselu, martin braithwaite","marc-andre ter stegen, jules kounde, ronald araujo, andreas christensen, alejandro balde, pedri, sergio busquets, frenkie de jong, raphinha, robert lewandowski, gavi"
341,2023-05-15,Real Betis,Rayo Vallecano,"claudio bravo, juan miranda, edgar gonzalez, german pezzella, youssouf sabaly, william carvalho, guido rodriguez, ayoze perez, sergio canales, luiz henrique, willian jose","stole dimitrievski, ivan balliu, abdul mumin, alejandro catena, fran garcia, santi comesaña, oscar valentin, isi palazon, oscar trejo, alvaro garcia, raul de tomas"
342,2023-05-19,Cádiz,Real Valladolid,"conan ledesma, alfonso espino, jorge mere, luis hernandez, iza carcelen, ruben alcaraz, gonzalo escalante, ruben sobrino, sergi guardiola, theo bongonda, chris ramos","jordi masip, joaquin fernandez, javi sanchez, jawad el yamiq, lucas rosa, monchu, martin hongla, kike perez, sergio escudero, sergio leon, cyle larin"
343,2023-05-20,Girona,Villarreal,"paulo gazzaniga, miguel gutierrez, juanpe, santiago bueno, arnau martinez, david lopez, ivan martin, rodrigo riquelme, viktor tsygankov, yan couto, taty castellanos","pepe reina, juan foyth, aissa mandi, jorge cuenca, alfonso pedraza, ramon terrats, etienne capoue, samu chukwueze, alex baena, yeremy pino, nicolas jackson"
344,2023-05-20,Athletic,Celta,"unai simon, yuri berchiche, aitor paredes, dani vivian, oscar de marcos, dani garcia, alex berenguer, iker muniain, oihan sancet, nico williams, iñaki williams","ivan villar, kevin vazquez, joseph aidoo, unai nuñez, javi galan, fran beltran, oscar rodriguez, carles perez, franco cervi, gabri veiga, jorgen strand larsen"
345,2023-05-20,Almería,Mallorca,"fernando martinez, alex centelles, stefan babic, rodrigo ely, alejandro pozo, gonzalo melero, samu costa, lucas robertone, adrian embarba, luis suarez, lazaro","predrag rajkovic, antonio sanchez, martin valjent, dennis hadzikadunic, jose copete, pablo maffeo, amath ndiaye, iddrisu baba, dani rodriguez, kang-in lee, vedat muriqi"
346,2023-05-20,Getafe,Elche,"david soria, omar alderete, stefan mitrovic, djene, gaston alvarez, nemanja maksimovic, mauro arambarri, damian suarez, munir el haddadi, carles aleña, enes unal","edgar badia, tete morente, pedro bigas, lisandro magallan, carlos clerc, lautaro blanco, fidel, john donald, gerard gumbau, randy nteka, lucas boye"
347,2023-05-20,Barcelona,R. Sociedad,"marc-andre ter stegen, jordi alba, andreas christenen, jules kounde, alejandro balde, frenkie de jong, sergio busquets, franck kessie, ousmane dembele, robert lewandowski, raphinha","alex remiro, aritz elustondo, igor zubeldia, robin le normand, diego rico, illarramendi, martin zubimendi, mohamed-ali cho, mikel merino, ander barrenetxea, alexander sorloth"
348,2023-05-21,Rayo Vallecano,Espanyol,"stole dimitrievski, fran garcia, alejandro catena, florian lejeune, ivan balliu, alvaro garcia, pathe ciss, santi comesaña, isi palazon, raul de tomas, oscar trejo","fernando pacheco, oscar gil, sergi gomez, leandro cabrera, brian olivan, fernando calero, sergi darder, javi puado, nicolas melamed, denis suarez, joselu"
349,2023-05-21,Atlético,Osasuna,"ivo grbic, yannick carrasco, mario hermoso, jose maria gimenez, axel witsel, nahuel molina, saul ñiguez, koke, rodrigo de paul, alvaro morata, antoine griezmann","sergio herrera, ruben peña, aridane hernandez, david garcia, manu sanchez, jon moncayola, lucas torro, aimar oroz, ruben garcia, ante budimir, chimy avila"
350,2023-05-21,Valencia,Real Madrid,"giorgi mamardashvili, jose luis gaya, cenk ozkaçar, eray comert, thierry correia, nico gonzalez, javi guerra, justin kluivert, andre almeida, diego lopez, edinson cavani","thibaut courtois, lucas vazquez, eder militao, antonio rudiger, ferland mendy, dani ceballos, aurelien tchouameni, eduardo camavinga, marco asensio, karim benzema, vinicius junior"
351,2023-05-21,Sevilla,Real Betis,"marko dmitrovic, alex telles, nemanja gudelj, karim rekik, gonzalo montiel, pape gueye, ivan rakitic, papu gomez, oliver torres, erik lamela, rafa mir","claudio bravo, youssouf sabaly, german pezzella, luiz felipe, abner, guido rodriguez, william carvalho, luiz henrique, sergio canales, ayoze perez, borja iglesias"
352,2023-05-23,Celta,Girona,"ivan villar, javi galan, unai nuñez, joseph aidoo, hugo mallo, oscar rodriguez, renato tapia, gabri veiga, miguel rodriguez, jorgen strand larsen, carles perez","paulo gazzaniga, arnau martinez, santiago bueno, bernardo espinosa, miguel gutierrez, yan couto, oriol romeu, ivan martin, valery fernandez, viktor tsygankov, christian stuani"
353,2023-05-23,R. Sociedad,Almería,"alex remiro, aihen muñoz, jon pacheco, robin le normand, andoni gorosabel, martin zubimendi, mikel oyarzabal, mikel merino, david silva, takefusa kubo, carlos fernandez","fernando martinez, alejandro pozo, rodrigo ely, stefan babic, sergio akieme, cesar de la hoz, samu costa, arnau puigmal, francisco portillo, lazaro, luis suarez"
354,2023-05-23,Real Valladolid,Barcelona,"jordi masip, lucas olaza, javi sanchez, joaquin fernandez, ivan fresneda, alvaro aguado, roque mesa, darwin machis, oscar plano, gonzalo plata, cyle larin","marc-andre ter stegen, sergi roberto, andreas christensen, marcos alonso, alejandro balde, gavi, eric garcia, frenkie de jong, raphinha, robert lewandowski, pablo torre"
355,2023-05-24,Elche,Sevilla,"edgar badia, carlos clerc, pedro bigas, john donald, josan, tete morente, fidel, gerard gumbau, nicolas fernandez, lucas boye, randy nteka","marko dmitrovic, jesus navas, loic bade, karim rekik, alex telles, fernando, pape gueye, lucas ocampos, erik lamela, marcos acuña, youssef en-nesyri"
356,2023-05-24,Real Madrid,Rayo Vallecano,"thibaut courtois, antonio rudiger, david alaba, nacho fernandez, daniel carvajal, eduardo camavinga, rodrygo, toni kroos, luka modric, federico valverde, karim benzema","stole dimitrievski, ivan balliu, florian lejeune, alejandro catena, fran garcia, santi comesaña, oscar valentin, isi palazon, unai lopez, alvaro garcia, sergio camello"
357,2023-05-24,Villarreal,Cádiz,"pepe reina, alberto moreno, pau torres, aissa mandi, kiko femenia, manu trigueros, dani parejo, yeremy pino, giovani lo celso, gerard moreno, nicolas jackson","conan ledesma, iza carcelen, luis hernandez, jorge mere, alfonso espino, ivan alejo, gonzalo escalante, fede san emeterio, ruben sobrino, sergi guardiola, theo bongonda"
