MatchNumber,Date,HomeTeam,AwayTeam,HomeLineup,AwayLineup
145,2022-12-30,Getafe,Mallorca,"david soria, portu, omar alderete, domingos duarte, djene, damian suarez, luis milla, angel algobia, carles aleña, borja mayoral, enes unal","predrag rajkovic, pablo maffeo, franco russo, antonio raillo, jose copete, jaume costa, dani rodriguez, iddrisu baba, rodrigo battaglia, kang-in lee, vedat muriqi"
146,2022-12-30,Cádiz,Almería,"conan ledesma, alfonso espino, fali, luis hernandez, iza carcelen, brian ocampo, alex fernandez, ruben alcaraz, theo bongonda, alvaro negredo, ruben sobrino","fernando martinez, alejandro pozo, chumi, stefan babic, sergio akieme, cesar de la hoz, leo baptistao, lucas robertone, gonzalo melero, largie ramazani, el bilal toure"
147,2022-12-30,Celta,Sevilla,"agustin marchesin, javi galan, unai nuñez, joseph aidoo, oscar mingueza, hugo mallo, franco cervi, fran beltran, gabri veiga, jorgen strand larsen, iago aspas","yassine bounou, jose angel carmona, nemanja gudelj, kike salas, jesus navas, joan jordan, fernando, marcos acuña, oliver torres, rafa mir, youssef en-nesiry"
148,2022-12-30,Real Valladolid,Real Madrid,"jordi masip, sergio escudero, javi sanchez, joaquin fernandez, ivan fresneda, alvaro aguado, monchu, roque mesa, oscar plano, sergio leon, ivan sanchez","thibaut courtois, daniel carvajal, antonio rudiger, david alaba, ferland mendy, federico valverde, toni kroos, dani ceballos, marco asensio, karim benzema, vinicius junior"
149,2022-12-31,Barcelona,Espanyol,"marc-andre ter stegen, jordi alba, marcos alonso, andreas christensen, sergi roberto, pedri, frenkie de jong, gavi, ansu fati, robert lewandowski, raphinha","alvaro fernandez, oscar gil, sergi gomez, leandro cabrera, brian olivan, vini souza, fernando calero, nicolas melamed, sergi darder, martin braithwaite, joselu"
150,2022-12-31,R. Sociedad,Osasuna,"alex remiro, diego rico, robin le normand, igor zubeldia, aritz elustondo, martin zubimendi, david silva, brais mendez, takefusa kubo, mohamed-ali cho, alexander sorloth","aitor fernandez, ruben peña, unai garcia, david garcia, juan cruz, manu sanchez, jon moncayola, lucas torro, moi gomez, chimy avila, aimar oroz"
151,2022-12-31,Villarreal,Valencia,"pepe reina, alberto moreno, pau torres, raul albiol, kiko femenia, etienne capoue, dani parejo, alex baena, yeremy pino, gerard moreno, samu chukwueze","giorgi mamardashvili, thierry correia, eray comert, mouctar diakhaby, jose luis gaya, yunus musah, nico gonzalez, andre almeida, samu castillejo, edinson cavani, samuel lino"
152,2023-01-06,Elche,Celta,"edgar badia, pedro bigas, diego gonzalez, helibelton palacios, carlos clerc, gerard gumbau, omar mascarell, tete morente, pere milla, lucas boye, roger marti","agustin marchesin, hugo mallo, oscar mingueza, joseph aidoo, unai nuñez, javi galan, gabri veiga, fran beltran, franco cervi, iago aspas, gonçalo paciencia"
153,2023-01-06,Valencia,Cádiz,"giorgi mamardashvili, jose luis gaya, mouctar diakhaby, eray comert, thierry correia, ilaix moriba, hugo guillamon, yunus musah, samuel lino, edinson cavani, samu castillejo","conan ledesma, iza carcelen, luis hernandez, fali, alfonso espino, fede san emeterio, ruben alcaraz, ruben sobrino, alex fernandez, brian ocampo, choco lozano"
154,2023-01-07,Villarreal,Real Madrid,"pepe reina, alberto moreno, pau torres, raul albiol, juan foyth, alex baena, dani parejo, francis coquelin, yeremy pino, gerard moreno, samu chukwueze","thibaut courtois, eder militao, antonio rudiger, david alaba, ferland mendy, toni kroos, aurelien tchouameni, luka modric, federico valverde, karim benzema, vinicius junior"
155,2023-01-07,Mallorca,Real Valladolid,"predrag rajkovic, jose copete, antonio raillo, martin valjent, jaume costa, iñigo ruiz de galarreta, iddrisu baba, giovanni gonzalez, amath ndiaye, dani rodriguez, vedat muriqi","jordi masip, ivan fresneda, joaquin fernandez, jawad el yamiq, lucas rosa, roque mesa, monchu, alvaro aguado, gonzalo plata, sergi guardiola, oscar plano"
156,2023-01-07,Espanyol,Girona,"alvaro fernandez, brian olivan, leandro cabrera, sergi gomez, oscar gil, sergi darder, fernando calero, edu exposito, martin braithwaite, joselu, nicolas melamed","paulo gazzaniga, arnau martinez, santiago bueno, david lopez, miguel gutierrez, ramon terrats, toni villa, ivan martin, aleix garcia, rodrigo riquelme, taty castellanos"
157,2023-01-08,Almería,R. Sociedad,"fernando martinez, sergio akieme, stefan babic, rodrigo ely,houboulang mendes, gonzalo melero, cesar de la hoz, lucas robertone, luis suarez, el bilal toure, largie ramazani","alex remiro, aritz elustondo, igor zubeldia, robin le normand, diego rico, martin zubimendi, mikel merino, david silva, illarramendi, takefusa kubo, alexander sorloth"
158,2023-01-08,Rayo Vallecano,Real Betis,"stole dimitrievski, fran garcia, alejandro catena, florian lejeune, ivan balliu, alvaro garcia, unai lopez, oscar valentin, isi palazon, oscar trejo, sergio camello","rui silva, aitor ruibal, german pezzella, edgar gonzalez, alex moreno, william carvalho, andres guardado, luiz henrique, nabil fekir, sergio canales, borja iglesias"
159,2023-01-08,Sevilla,Getafe,"yassine bounou, nemanja gudelj, fernando, tanguy nianzou, joan jordan, marcos acuña, ivan rakitic, oliver torres, jesus navas, youssef en-nesyri, erik lamela","david soria, damian suarez, djene, domingos duarte, omar alderete, juan iglesias, carles aleña, angel algobia, luis milla, enes unal, borja mayoral"
160,2023-01-08,Atlético,Barcelona,"jan oblak, reinildo mandava, jose maria gimenez, stefan savic, nahuel molina, yannick carrasco, pablo barrios, koke, marcos llorente, joao felix, antoine griezmann","marc-andre ter stegen, jules kounde, ronald araujo, andreas christensen, alejandro balde, gavi, sergio busquets, frenkie de jong, ousmane dembele, ansu fati, pedri"
161,2023-01-09,Athletic,Osasuna,"unai simon, yuri berchiche, yeray alvarez, dani vivian, oscar de marcos, oier zarraga, mikel vesga, nico williams, oihan sancet, iñaki williams, gorka guruzeta","aitor fernandez, diego moreno, aridane hernandez, david garcia, juan cruz, darko brasanac, lucas torro, moi gomez, jon moncayola, ante budimir, abde ezzalzouli"
162,2023-01-13,Celta,Villarreal,"agustin marchesin, unai nuñez, joseph aidoo, oscar mingueza, javi galan, oscar rodriguez, fran beltran, hugo mallo, franco cervi, gabri veiga, iago aspas","pepe reina, juan foyth, aissa mandi, pau torres, johan mojica, dani parejo, samu chukwueze, manu trigueros, francis coquelin, jose luis morales, gerard moreno"
163,2023-01-14,Real Valladolid,Rayo Vallecano,"jordi masip, lucas rosa, javi sanchez, joaquin fernandez, ivan fresneda, kike perez, monchu, ivan sanchez, kenedy, sergi guardiola, gonzalo plata","stole dimitrievski, ivan balliu, florian lejeune, alejandro catena, fran garcia, santi comesaña, oscar valentin, isi palazon, unai lopez, alvaro garcia, sergio camello"
164,2023-01-14,Girona,Sevilla,"paulo gazzaniga, miguel gutierrez, david lopez, santiago bueno, arnau martinez, rodrigo riquelme, aleix garcia, oriol romeu, toni villa, christian stuani, ivan martin","yassine bounou, jesus navas, tanguy nianzou, fernando, loic bade, marcos acuña, joan jordan, nemanja gudelj, ivan rakitic, oliver torres, rafa mir"
165,2023-01-14,Osasuna,Mallorca,"aitor fernandez, manu sanchez, david garcia, aridane hernandez, diego moreno, moi gomez, lucas torro, aimar oroz, abde ezzalzouli, ante budimir, chimy avila","predrag rajkovic, pablo maffeo, martin valjent, antonio raillo, jose copete, jaume costa, dani rodriguez, iddrisu baba, clement grenier, kang-in lee, vedat muriqi"
166,2023-01-14,R. Sociedad,Athletic,"alex remiro, diego rico, robin le normand, igor zubeldia, aritz elustondo, martin zubimendi, mikel merino, david silva, brais mendez, alexander sorloth, takefusa kubo","unai simon, oscar de marcos, dani vivian, yeray alvarez, yuri berchiche, dani garcia, mikel vesga, iñaki williams, oihan sancet, nico williams, gorka guruzeta"
167,2023-01-15,Getafe,Espanyol,"david soria, portu, omar alderete, domingos duarte, djene, damian suarez, angel algobia, luis milla, carles aleña, enes unal, borja mayoral","alvaro fernandez, fernando calero, cesar montes, leandro cabrera, aleix vidal, vini souza, sergi darder, oscar gil, martin braithwaite, javi puado, joselu"
168,2023-01-15,Almería,Atlético,"fernando martinez, sergio akieme, chumi, rodrigo ely, alejandro pozo, gonzalo melero, samu costa, lucas robertone, adrian embarba, el bilal toure, leo baptistao","jan oblak, nahuel molina, axel witsel, mario hermoso, reinildo mandava, geoffrey kondogbia, marcos llorente, koke, antoine griezmann, thomas lemar, angel correa"
169,2023-01-16,Cádiz,Elche,"conan ledesma, alfonso espino, fali, luis hernandez, iza carcelen, brian ocampo, fede san emeterio, ruben alcaraz, ruben sobrino, alex fernandez, choco lozano","edgar badia, helibelton palacios, enzo roco, diego gonzalez, jose angel carmona, omar mascarell, gerard gumbau, carlos clerc, pere milla, lucas boye, roger marti"
170,2023-02-01,Real Betis,Barcelona,"rui silva, abner, luiz felipe, german pezzella, aitor ruibal, william carvalho, guido rodriguez, sergio canales, nabil fekir, luiz henrique, borja iglesias","marc-andre ter stegen, jules kounde, ronald araujo, andreas christensen, alejandro balde, frenkie de jong, sergio busquets, pedri, raphinha, robert lewandowski, gavi"
171,2023-02-02,Real Madrid,Valencia,"thibaut courtois, eduardo camavinga, antonio rudiger, eder militao, nacho fernandez, dani ceballos, toni kroos, luka modric, vinicius junior, karim benzema, marco asensio","giorgi mamardashvili, dimitri foulquier, gabriel paulista, mouctar diakhaby, jose luis gaya, yunus musah, hugo guillamon, andre almeida, samu castillejo, edinson cavani, samuel lino"
172,2023-01-20,Mallorca,Celta,"predrag rajkovic, jaume costa, matija nastasic, antonio raillo, martin valjent, pablo maffeo, amath ndiaye, iñigo ruiz de galarreta, iddrisu baba, dani rodriguez, vedat muriqi","agustin marchesin, hugo mallo, oscar mingueza, joseph aidoo, unai nuñez, franco cervi, gabri veiga, fran beltran, luca de la torrea, jorgen strand larsen, iago aspas"
173,2023-01-21,Rayo Vallecano,R. Sociedad,"stole dimitrievski, fran garcia, alejandro catena, florian lejeune, ivan balliu, pathe ciss, unai lopez, alvaro garcia, oscar trejo, isi palazon, sergio camello","alex remiro, aritz elustondo, igor zubeldia, robin le normand, diego rico, brais mendez, illarramendi, pablo marin, david silva, alexander sorloth, ander barrenetxea"
174,2023-01-21,Espanyol,Real Betis,"alvaro fernandez, brian olivan, leandro cabrera, cesar montes, oscar gil, javi puado, sergi darder, vini souza, aleix vidal, martin braithwaite, joselu","claudio bravo, aitor ruibal, german pezzella, edgar gonzalez, abner, guido rodriguez, william carvalho, luiz henrique, sergio canales, andres guardado, borja iglesias"
175,2023-01-21,Atlético,Real Valladolid,"jan oblak, reinildo mandava, mario hermoso, axel witsel, nahuel molina, koke, antoine griezmann, thomas lemar, marcos llorente, angel correa, alvaro morata","jordi masip, luis perez, javi sanchez, jawad el yamiq, david torres, lucas olaza, kike perez, alvaro aguado, oscar plano, shon weissman, sergio leon"
176,2023-01-21,Sevilla,Cádiz,"yassine bounou, karim rekik, nemanja gudelj, loic bade, erik lamela, joan jordan, fernando, jesus navas, ivan rakitic, oliver torres, youssef en-nesyri","conan ledesma, iza carcelen, luis hernandez, momo mbaye, alfonso espino, theo bongonda, ruben alcaraz, alex fernandez, brian ocampo, ruben sobrino, choco lozano"
177,2023-01-22,Villarreal,Girona,"pepe reina, johan mojica, pau torres, jorge cuenca, aissa mandi, alex baena, dani parejo, etienne capoue, yeremy pino, gerard moreno, samu chukwueze","paulo gazzaniga, arnau martinez, santiago bueno, bernardo espinosa, miguel gutierrez, oriol romeu, aleix garcia, toni villa, ivan martin, rodrigo riquelme, christian stuani"
178,2023-01-22,Elche,Osasuna,"edgar badia, pedro bigas, enzo roco, helibelton palacios, lautaro blanco, gerard gumbau, omar mascarell, jose angel carmona, fidel, lucas boye, pere milla","aitor fernandez, diego moreno, aridane hernandez, david garcia, manu sanchez, moi gomez, pablo ibañez, darko brasanac, chimy avila, ante budimir, kike barja"
179,2023-01-22,Barcelona,Getafe,"marc-andre ter stegen, alejandro balde, andreas christensen, jules kounde, sergi roberto, gavi, sergio busquets, pedri, raphinha, ansu fati, ousmane dembele","david soria, damian suarez, djene, domingos duarte, omar alderete, juan iglesias, borja mayoral, angel algobia, luis milla, carles aleña, enes unal"
180,2023-01-22,Athletic,Real Madrid,"unai simon, yuri berchiche, aitor paredes, dani vivian, oscar de marcos, mikel vesga, oier zarraga, alex berenguer, oihan sancet, nico williams, iñaki williams","thibaut courtois, nacho fernandez, eder militao, antonio rudiger, ferland mendy, federico valverde, eduardo camavinga, dani ceballos, marco asensio, karim benzema, vinicius junior"
181,2023-01-23,Valencia,Almería,"giorgi mamardashvili, jose luis gaya, cenk ozkaçar, gabriel paulista, dimitri foulquier, justin kluivert, andre almeida, yunus musah, toni lato, edinson cavani, samuel lino","fernando martinez, houboulang mendes, chumi, rodrigo ely, sergio akieme, lucas robertone, samu costa, gonzalo melero, leo baptistao, el bilal toure, largie ramazani"
182,2023-01-27,Almería,Espanyol,"fernando martinez, sergio akieme, stefan babic, rodrigo ely, alejandro pozo, gonzalo melero, cesar de la hoz, lucas robertone, adrian embarba, luis suarez, leo baptistao","alvaro fernandez, oscar gil, cesar montes, leandro cabrera, brian olivan, vini souza, aleix vidal, sergi darder, javi puado, martin braithwaite, joselu"
183,2023-01-28,Cádiz,Mallorca,"conan ledesma, alfonso espino, momo mbaye, luis hernandez, iza carcelen, brian ocampo, alex fernandez, ruben alcaraz, theo bongonda, alvaro negredo, choco lozano","predrag rajkovic, pablo maffeo, martin valjent, antonio raillo, jose copete, jaume costa, dani rodriguez, iñigo ruiz de galarreta, clement grenier, kang-in lee, vedat muriqi"
184,2023-01-28,Girona,Barcelona,"paulo gazzaniga, miguel gutierrez, juanpe, bernardo espinosa, arnau martinez, rodrigo riquelme, aleix garcia, oriol romeu, yan couto, taty castellanos, yangel herrera","marc-andre ter stegen, jules kounde, ronald araujo, eric garcia, marcos alonso, gavi, sergio busquets, frenkie de jong, raphinha, ansu fati, ousmane dembele"
185,2023-01-28,Sevilla,Elche,"yassine bounou, marcos acuña, karim rekik, loic bade, jesus navas, ivan rakitic, fernando, oliver torres, lucas ocampos, youssef en-nesyri, suso","edgar badia, diego gonzalez, enzo roco, pedro bigas, helibelton palacios, omar mascarell, gerard gumbau, lautaro blanco, fidel, pere milla, lucas boye"
186,2023-01-28,Getafe,Real Betis,"david soria, juan iglesias, omar alderete, domingos duarte, djene, damian suarez, carles aleña, luis milla, angel algobia, borja mayoral, enes unal","rui silva, youssouf sabaly, german pezzella, luiz felipe, juan miranda, guido rodriguez, william carvalho, sergio canales, rodri sanchez, luiz henrique, borja iglesias"
187,2023-01-29,Real Valladolid,Valencia,"jordi masip, lucas olaza, javi sanchez, joaquin fernandez, lucas rosa, alvaro aguado, roque mesa, kike perez, darwin machis, sergio leon, oscar plano","giorgi mamardashvili, cristhian mosquera, eray comert, cenk ozkaçar, jose luis gaya, andre almeida, yunus musah, toni lato, samu castillejo, edinson cavani, samuel lino"
188,2023-01-29,Osasuna,Atlético,"aitor fernandez, manu sanchez, david garcia, aridane hernandez, diego moreno, moi gomez, lucas torro, pablo ibañez, abde ezzalzouli, chimy avila, ruben garcia","jan oblak, nahuel molina, jose maria gimenez, mario hermoso, reinildo mandava, rodrigo de paul, koke, pablo barrios, thomas lemar, antoine griezmann, angel correa"
189,2023-01-29,Celta,Athletic,"agustin marchesin, javi galan, unai nuñez, joseph aidoo, oscar mingueza, luca de la torre, oscar rodriguez, renato tapia, carles perez, iago aspas, gabri veiga","unai simon, iñigo lekue, yeray alvarez, dani vivian, yuri berchiche, ander herrera, dani garcia, nico williams, iker muniain, alex berenguer, gorka guruzeta"
190,2023-01-29,Real Madrid,R. Sociedad,"thibaut courtois, eduardo camavinga, antonio rudiger, eder militao, nacho fernandez, dani ceballos, toni kroos, federico valverde, vinicius junior, karim benzema, rodrygo","alex remiro, aritz elustondo, igor zubeldia, robin le normand, aihen muñoz, brais mendez, martin zubimendi, illarramendi, mikel oyarzabal, alexander sorloth, takefusa kubo"
191,2023-01-30,Villarreal,Rayo Vallecano,"filip jorgensen, alberto moreno, jorge cuenca, raul albiol, juan foyth, dani parejo, yeremy pino, alex baena, etienne capoue, samu chukwueze, gerard moreno","stole dimitrievski, ivan balliu, florian lejeune, alejandro catena, fran garcia, santi comesaña, pathe ciss, isi palazon, oscar trejo, andres martin, sergio camello"
192,2023-02-03,Athletic,Cádiz,"unai simon, yuri berchiche, yeray alvarez, dani vivian, oscar de marcos, mikel vesga, alex berenguer, iker muniain, oihan sancet, nico williams, raul garcia","conan ledesma, iza carcelen, luis hernandez, momo mbaye, alfonso espino, fali, theo bongonda, gonzalo escalante, alex fernandez, brian ocampo, roger marti"
193,2023-02-04,Espanyol,Osasuna,"alvaro fernandez, brian olivan, leandro cabrera, cesar montes, ronale pierre-gabriel, nicolas melamed, sergi darder, fernando calero, aleix vidal, javi puado, martin braithwaite","aitor fernandez, diego moreno, unai garcia, david garcia, juan cruz, lucas torro, chimy avila, jon moncayola, moi gomez, abde ezzalzouli, ante budimir"
194,2023-02-04,Elche,Villarreal,"edgar badia, lisandro magallan, enzo roco, helibelton palacios, carlos clerc, gerard gumbau, omar mascarell, jose angel carmona, pere milla, lucas boye, ezequiel ponce","pepe reina, juan foyth, raul albiol, jorge cuenca, johan mojica, etienne capoue, dani parejo, alex baena, samu chukwueze, gerard moreno, yeremy pino"
195,2023-02-04,Atlético,Getafe,"jan oblak, reinildo mandava, mario hermoso, stefan savic, nahuel molina, thomas lemar, koke, rodrigo de paul, angel correa, alvaro morata, antoine griezmann","david soria, portu, djene, domingos duarte, omar alderete, gaston alvarez, luis milla, mauro arambarri, carles aleña, borja mayoral, enes unal"
196,2023-02-04,Real Betis,Celta,"rui silva, juan miranda, luiz felipe, german pezzella, youssouf sabaly, andres guardado, guido rodriguez, juanmi, nabil fekir, sergio canales, borja iglesias","ivan villar, oscar mingueza, joseph aidoo, unai nuñez, javi galan, carles perez, gabri veiga, fran beltrán, luca de la torre, iago aspas, jorgen strand larsen"
197,2023-02-05,Mallorca,Real Madrid,"predrag rajkovic, jaume costa, matija nastasic, antonio raillo, giovanni gonzalez, pablo maffeo, kang-in lee, iñigo ruiz de galarreta, iddrisu baba, dani rodriguez, vedat muriqi","andriy lunin, daniel carvajal, antonio rudiger, nacho fernandez, eduardo camavinga, federico valverde, aurelien tchouameni, dani ceballos, marco asensio, rodrygo, vinicius junior"
198,2023-02-05,Girona,Valencia,"paulo gazzaniga, miguel gutierrez, bernardo espinosa, santiago bueno, valery fernandez, toni villa, oriol romeu, aleix garcia, ivan martin, taty castellanos, borja garcia","giorgi mamardashvili, dimitri foulquier, eray comert, cenz okzaçar, jose luis gaya, hugo guillamon, samuel lino, yunus musah, andre almeida, toni lato, edinson cavani"
199,2023-02-05,R. Sociedad,Real Valladolid,"alex remiro, diego rico, robin le normand, igor zubeldia, ander barrenetxea, illarramendi, martin zubimendi, pablo marin, robert navarro, takefusa kubo, alexander sorloth","jordi masip, luis perez, martin hongla, javi sanchez, lucas olaza, monchu, kike perez, gonzalo plata, oscar plano, darwin machis, sergio leon"
200,2023-02-05,Barcelona,Sevilla,"marc-andre ter stegen, jordi alba, andreas christensen, ronald araujo, jules kounde, frenkie de jong, sergio busquets, pedri, gavi, robert lewandowski, raphinha","yassine bounou, gonzalo montiel, loic bade, nemanja gudelj, karim rekik, marcos acuña, oliver torres, pape gueye, joan jordan, ivan rakitic, youssef en-nesyri"
201,2023-02-06,Rayo Vallecano,Almería,"stole dimitrievski, fran garcia, alejandro catena, florian lejeune, ivan balliu, santi comesaña, oscar valentin, andres martin, oscar trejo, isi palazon, sergio camello","fernando martinez, alejandro pozo, rodrigo ely, stefan babic, sergio akieme, lucas robertone, samu costa, gonzalo melero, leo baptistao, luis suarez, adrian embarba"
202,2023-02-10,Cádiz,Girona,"conan ledesma, alfonso espino, fali, luis hernandez, iza carcelen, brian ocampo, ruben alcaraz, gonzalo escalante, theo bongonda, roger marti, sergi guardiola","paulo gazzaniga, arnau martinez, santiago bueno, bernardo espinosa, miguel gutierrez, ivan martin, aleix garcia, oriol romeu, toni villa, borja garcia, taty castellanos"
203,2023-02-11,Almería,Real Betis,"fernando martinez, sergio akieme, stefan babic, rodrigo ely, alejandro pozo, samu costa, iñigo eguaras, francisco portillo, gonzalo melero, adrian embarba, luis suarez","rui silva, youssouf sabaly, german pezzella, edgar gonzalez, abner, guido rodriguez, andres guardado, sergio canales, rodri sanchez, juanmi, borja iglesias"
204,2023-02-11,Sevilla,Mallorca,"yassine bounou, nemanja gudelj, loic bade, tanguy nianzou, bryan gil, pape gueye, fernando, jesus navas, oliver torres, suso, youssef en-nesyri","predrag rajkovic, pablo maffeo, martin valjent, antonio raillo, matija nastasic, ludwig augustinsson, dani rodriguez, iñigo ruiz de galarreta, iddrisu baba, kang-in lee, vedat muriqi"
205,2023-02-11,Valencia,Athletic,"giorgi mamardashvili, jose luis gaya, mouctar diakhaby, eray comert, dimitri foulquier, ilaix moriba, andre almeida, yunus musah, samuel lino, edinson cavani, samu castillejo","unai simon, oscar de marcos, dani vivian, yeray alvarez, iñigo lekue, oihan sancet, mikel vesga, nico williams, iker muniain, alex berenguer, raul garcia"
206,2023-02-12,Getafe,Rayo Vallecano,"david soria, gaston alvarez, omar alderete, domingos duarte, portu, carles aleña, luis milla, mauro arambarri, gonzalo villar, borja mayoral, enes unal","stole dimitrievski, ivan balliu, florian lejeune, alejandro catena, fran garcia, oscar valentin, santi comesaña, isi palazon, oscar trejo, alvaro garcia, sergio camello"
207,2023-02-12,Celta,Atlético,"ivan villar, javi galan, renato tapia, joseph aidoo, oscar mingueza, luca de la torre, fran beltran, gabri veiga, carles perez, jorgen strand larsen, iago aspas","jan oblak, nahuel molina, stefan savic, mario hermoso, reinildo mandava, rodrigo de paul, koke, pablo barrios, marcos llorente, alvaro morata, antoine griezmann"
208,2023-02-12,Real Valladolid,Osasuna,"jordi masip, lucas olaza, javi sanchez, martin hongla, luis perez, kike perez, monchu, darwin machis, oscar plano, gonzalo plata, sergio leon","aitor fernandez, jon moncayola, aridane hernandez, juan cruz, manu sanchez, pablo ibañez, lucas torro, moi gomez, chimy avila, ante budimir, kike barja"
209,2023-02-12,Villarreal,Barcelona,"pepe reina, alberto moreno, pau torres, raul albiol, juan foyth, alex baena, dani parejo, etienne capoue, francis coquelin, yeremy pino, jose luis morales","marc-andre ter stegen, jules kounde, ronald araujo, andreas christensen, alejandro balde, pedri, frankie de jong, franck kessie, raphinha, robert lewandowski, gavi"
210,2023-02-13,Espanyol,R. Sociedad,"alvaro fernandez, brian olivan, leandro cabrera, fernando calero, oscar gil, nicolas melamed, vini souza, sergi darder, aleix vidal, martin braithwaite, javi puado","alex remiro, ander barrenetxea, igor zubeldia, robin le normand, diego rico, martin zubimendi, takefusa kubo, brais mendez, illarramendi, mikel oyarzabal, alexander sorloth"
211,2023-02-15,Real Madrid,Elche,"andriy lunin, david alaba, nacho fernandez, eder militao, daniel carvajal, dani ceballos, eduardo camavinga, federico valverde, rodrygo, karim benzema, marco asensio","edgar badia, diego gonzalez, enzo roco, lisando magallan, jose angel carmona, raul guti, gerard gumbau, fidel, carlos clerc, randy nteka, ezequiel ponce"
212,2023-02-17,Girona,Almería,"paulo gazzaniga, javier hernandez, juanpe, santiago bueno, arnau martinez, rodrigo riquelme, aleix garcia, oriol romeu, viktor tsygankov, taty castellanos, borja garcia","fernando martinez, houboulang mendes, rodrigo ely, stefan babic, sergio akieme, lucas robertone, cesar de la hoz, samu costa, leo baptistao, luis suarez, adrian embarba"
213,2023-02-18,R. Sociedad,Celta,"alex remiro, diego rico, robin le normand, igor zubeldia, ander barrenetxea, martin zubimendi, illarramendi, brais mendez, takefusa kubo, mikel oyarzabal, alexander sorloth","ivan villar, oscar mingueza, joseph aidoo, unai nuñez, javi galan, carles perez, gabri veiga, fran beltran, luca de la torre, iago aspas, jorgen strand larsen"
214,2023-02-18,Real Betis,Real Valladolid,"claudio bravo, abner, victor ruiz, luiz felipe, youssouf sabaly, william carvalho, guido rodriguez, juanmi, nabil fekir, sergio canales, ayoze perez","jordi masip, luis perez, martin hongla, javi sanchez, lucas olaza, monchu, kike perez, gonzalo plata, oscar plano, darwin machis, cyle larin"
215,2023-02-18,Mallorca,Villarreal,"predrag rajkovic, jaume costa, jose copete, antonio raillo, giovanni gonzalez, pablo maffeo, kang-in lee, iñigo ruiz de galarreta, dani rodriguez, tino kadewere, vedat muriqi","pepe reina, juan foyth, raul albiol, pau torres, johan mojica, dani parejo, samu chukwueze, etienne capoue, manu trigueros, yeremy pino, jose luis morales"
